temp,questions,choice1,choice2,choice3,choice4,answer
temp_data1,What method of cyber attack is phishing,Ransomware,Identity Fraud,Social Engineering,Credit card fraud,1
temp_data2,Which of the following is NOT a red flag on a phishing email,A sense of urgency,A request for payment,Prompt to click on a link,Use of your first and last name,1
temp_data3,What should you do if you believe you have received a phishing email,Ask a colleague if they have received the same message,Report the message using the report phishing button within Outlook,Click on any links to check if they are legitimate,Ask the sender for more information,1
temp_data4,How can social media presence lead to phishing attacks,It doesn't,Cyber criminals can use it as a source for data mining,Cyber criminals will know who your friends are,Social media makes your devices slower,1
temp_data5,Why are phishing attacks considered so dangerous,They act as catalysts for larger cyber attacks,They allow malicious code to be installed onto your devices,They are the most common type of cyber attack,All of the above,1
